{
  "schemaVersion": "1.0",
  "environmentName": "fixture",
  "tenantId": "11111111-1111-4111-8111-111111111111",
  "pilotGroupId": "22222222-2222-4222-8222-222222222222",
  "entraObjectId": "55555555-5555-4555-8555-555555555555",
  "aadDeviceId": "66666666-6666-4666-8666-666666666666",
  "managedDeviceId": "77777777-7777-4777-8777-777777777777",
  "release": "2026.8"
}
